{
  "schema_version": "archive-seeds-experiment-manifest-v1",
  "name": "local-mmap-thread-cache-matrix-example",
  "kind": "local_matrix",
  "cases": [
    {
      "name": "mmap-process-cold-t1",
      "command": ["jam", "--threads", "1", "trace", "--query", "tests/data/trace_mge/query_linear_plasmid.fa", "--database", "tests/data/trace/catalog.jam", "--metagenomes", "tools/out/archive-seeds/catalog.tsv", "--output", "tools/out/archive-seeds/local-process-cold-t1.jsonl", "--sensitivity", "sensitive"],
      "metadata": {"backend": "native_jma", "access": "local-mmap", "cache_state": "process-cold", "cache_policy": "new-process; OS page-cache state is not controlled", "threads": 1, "io_concurrency": 1, "output_paths": ["tools/out/archive-seeds/local-process-cold-t1.jsonl"], "input_paths": ["tests/data/trace_mge/query_linear_plasmid.fa", "tests/data/trace/catalog.jam", "tools/out/archive-seeds/catalog.tsv"], "measurement": "query-latency-rss-and-selective-bytes"}
    },
    {
      "name": "mmap-process-cold-t4",
      "command": ["jam", "--threads", "4", "trace", "--query", "tests/data/trace_mge/query_linear_plasmid.fa", "--database", "tests/data/trace/catalog.jam", "--metagenomes", "tools/out/archive-seeds/catalog.tsv", "--output", "tools/out/archive-seeds/local-process-cold-t4.jsonl", "--sensitivity", "sensitive", "--io-concurrency", "1"],
      "metadata": {"backend": "native_jma", "access": "local-mmap", "cache_state": "process-cold", "cache_policy": "new-process; OS page-cache state is not controlled", "threads": 4, "io_concurrency": 1, "output_paths": ["tools/out/archive-seeds/local-process-cold-t4.jsonl"], "input_paths": ["tests/data/trace_mge/query_linear_plasmid.fa", "tests/data/trace/catalog.jam", "tools/out/archive-seeds/catalog.tsv"], "measurement": "query-latency-rss-and-selective-bytes"}
    },
    {
      "name": "mmap-process-cold-t8",
      "command": ["jam", "--threads", "8", "trace", "--query", "tests/data/trace_mge/query_linear_plasmid.fa", "--database", "tests/data/trace/catalog.jam", "--metagenomes", "tools/out/archive-seeds/catalog.tsv", "--output", "tools/out/archive-seeds/local-process-cold-t8.jsonl", "--sensitivity", "sensitive", "--io-concurrency", "1"],
      "metadata": {"backend": "native_jma", "access": "local-mmap", "cache_state": "process-cold", "cache_policy": "new-process; OS page-cache state is not controlled", "threads": 8, "io_concurrency": 1, "output_paths": ["tools/out/archive-seeds/local-process-cold-t8.jsonl"], "input_paths": ["tests/data/trace_mge/query_linear_plasmid.fa", "tests/data/trace/catalog.jam", "tools/out/archive-seeds/catalog.tsv"], "measurement": "query-latency-rss-and-selective-bytes"}
    },
    {
      "name": "mmap-process-warm-t1",
      "command": ["jam", "--threads", "1", "trace", "--query", "tests/data/trace_mge/query_linear_plasmid.fa", "--database", "tests/data/trace/catalog.jam", "--metagenomes", "tools/out/archive-seeds/catalog.tsv", "--output", "tools/out/archive-seeds/local-process-warm-t1.jsonl", "--sensitivity", "sensitive"],
      "metadata": {"backend": "native_jma", "access": "local-mmap", "cache_state": "process-warm", "cache_policy": "new-process over archive pages touched by the immediately preceding cold/warm setup; OS page-cache state is not controlled", "threads": 1, "io_concurrency": 1, "output_paths": ["tools/out/archive-seeds/local-process-warm-t1.jsonl"], "input_paths": ["tests/data/trace_mge/query_linear_plasmid.fa", "tests/data/trace/catalog.jam", "tools/out/archive-seeds/catalog.tsv"], "measurement": "query-latency-rss-and-selective-bytes"}
    },
    {
      "name": "mmap-process-warm-t4",
      "command": ["jam", "--threads", "4", "trace", "--query", "tests/data/trace_mge/query_linear_plasmid.fa", "--database", "tests/data/trace/catalog.jam", "--metagenomes", "tools/out/archive-seeds/catalog.tsv", "--output", "tools/out/archive-seeds/local-process-warm-t4.jsonl", "--sensitivity", "sensitive", "--io-concurrency", "1"],
      "metadata": {"backend": "native_jma", "access": "local-mmap", "cache_state": "process-warm", "cache_policy": "new-process over archive pages touched by the immediately preceding cold/warm setup; OS page-cache state is not controlled", "threads": 4, "io_concurrency": 1, "output_paths": ["tools/out/archive-seeds/local-process-warm-t4.jsonl"], "input_paths": ["tests/data/trace_mge/query_linear_plasmid.fa", "tests/data/trace/catalog.jam", "tools/out/archive-seeds/catalog.tsv"], "measurement": "query-latency-rss-and-selective-bytes"}
    },
    {
      "name": "mmap-process-warm-t8",
      "command": ["jam", "--threads", "8", "trace", "--query", "tests/data/trace_mge/query_linear_plasmid.fa", "--database", "tests/data/trace/catalog.jam", "--metagenomes", "tools/out/archive-seeds/catalog.tsv", "--output", "tools/out/archive-seeds/local-process-warm-t8.jsonl", "--sensitivity", "sensitive", "--io-concurrency", "1"],
      "metadata": {"backend": "native_jma", "access": "local-mmap", "cache_state": "process-warm", "cache_policy": "new-process over archive pages touched by the immediately preceding cold/warm setup; OS page-cache state is not controlled", "threads": 8, "io_concurrency": 1, "output_paths": ["tools/out/archive-seeds/local-process-warm-t8.jsonl"], "input_paths": ["tests/data/trace_mge/query_linear_plasmid.fa", "tests/data/trace/catalog.jam", "tools/out/archive-seeds/catalog.tsv"], "measurement": "query-latency-rss-and-selective-bytes"}
    }
  ]
}
